title,year,place,latitude,longitude,description,image
Nacimiento de Leonor López de Córdoba,1362,Calatayud,41.3532,-1.6435,"Leonor nació en Calatayud, hija de una poderosa familia noble.",https://lclcarmen1bac.wordpress.com/wp-content/uploads/2019/02/leonor-lopez-cordoba.jpg
Asesinato de su padre,1369,Sevilla,37.3886,-5.9823,"Su padre fue ejecutado tras la victoria de Enrique II en la guerra civil castellana.",https://placehold.co/300x300/png
Prisión con su madre,1370,Castillo de Carmona,37.4708,-5.6465,"Leonor y su madre fueron encarceladas durante casi ocho años.",https://placehold.co/300x300/png
Liberación,1378,Carmona,37.4708,-5.6465,"Liberada junto a su madre gracias a intervenciones cortesanas.",https://placehold.co/300x300/png
Matrimonio con Ruy Gutiérrez de Henestrosa,1380,Sevilla,37.3886,-5.9823,"Se casó con un noble cercano a la corte de Juan I.",https://placehold.co/300x300/png
Influencia en la corte,1388,Segovia,40.9429,-4.1088,"Comenzó a ejercer influencia como consejera de la reina Catalina de Lancaster.",https://placehold.co/300x300/png
Caída en desgracia,1406,Toledo,39.8628,-4.0273,"Perdió el favor de la reina Catalina tras conflictos en la corte.",https://placehold.co/300x300/png
Redacción de las Memorias,1409,Córdoba,37.8882,-4.7794,"Compuso sus 'Memorias', consideradas una de las primeras autobiografías en castellano.",https://placehold.co/300x300/png
